Sheet: Sheet1
D3: In Euro | E3: In % von D4 | G3: In Euro | H3: In USD | I3: In % von H4 | K3: In Euro | L3: In Franc | M3: In % von L4
C4: Arbeitgeber zahlt | D4: of:=[.D5]+[.D21]+[.D22]+[.D23]+[.D24] -> 70986.15 | E4: of:=[.D4]/[.D$4]*100 -> 100 | G4: of:=[.H4]/[.C$48] -> 64590 | H4: of:=[.H5]+[.H15] -> 75570.3 | I4: of:=[.H4]/[.H$4]*100 -> 100 | K4: of:=[.L4]/[.C$49] -> 65518.4482758621 | L4: of:=[.L5]+[.L25]+[.L26]+[.L27]+[.L28]+[.L29] -> 76001.4 | M4: of:=[.L4]/[.L$4]*100 -> 100
B5: Einkuenfte aus nichtselbstaendiger Arbeit | C5: Gehalt | D5: 60000 | E5: of:=[.D5]/[.D$4]*100 -> 84.5235302942898 | G5: of:=[.H5]/[.C$48] -> 60000 | H5: of:=[.D5]*[.C48] -> 70200 | I5: of:=[.H5]/[.H$4]*100 -> 92.8936367858802 | K5: of:=[.L5]/[.C$49] -> 60000 | L5: of:=[.D5]*[.C49] -> 69600 | M5: of:=[.L5]/[.L$4]*100 -> 91.577260418887 | N5: Steuerbares Einkommen
B7: Einkommensteuer | C7: Formel aus 2016 | D7: of:=IF([.D76] > 254446; 0.45*([.D76]-254447) + 98473.18; IF([.D76] > 53665; 0.42*([.D76] - 53665) + 14145.16; IF([.D76] > 13669; 0.2397 * ([.D76] - 13669) + (([.D76] - 13669)/10000 )^2 * 225.4 + 952.48 ; IF([.D76] > 8652; 0.14 * ([.D76] - 8652) + (([.D76] - 8652) / 10000)^2*993.62; 0)))) -> 12686.0129535048 | E7: of:=[.D7]/[.D$4]*100 -> 17.8711100031553 | G7: of:=[.H7]/[.C$48] -> 10001.0683760684 | H7: of:=[.H66] -> 11701.25 | I7: of:=[.H7]/[.H$4]*100 -> 15.4839268866208 | J7: Fed | K7: of:=[.L7]/[.C$49] -> 890.620689655172 | L7: of:=[.P77] -> 1033.12 | M7: of:=[.L7]/[.L$4]*100 -> 1.35934338051667 | N7: Direkte Bundesteuer
B8: Solidatiaetsz | D8: of:=[.D7]*0.055 -> 697.730712442766 | E8: of:=[.D8]/[.D$4]*100 -> 0.982911050173542 | G8: of:=[.H8]/[.C$48] -> 3008.56239316239 | H8: of:=[.H80] -> 3520.018 | I8: of:=[.H8]/[.H$4]*100 -> 4.6579383699681 | J8: CA | K8: of:=[.L8]/[.C$49] -> 3098.27586206897 | L8: of:=[.T80] -> 3594 | M8: of:=[.L8]/[.L$4]*100 -> 4.72886025783736 | N8: Staatssteuer
B10: Arbeitnehmer | N10: Arbeitnehmer
B11: RV | D11: of:=IF([.D$5]>[.C41]; [.C41] * [.E41] / 2; [.D$5] * [.E41] / 2) -> 5610 | E11: of:=[.D11]/[.D$4]*100 -> 7.9029500825161 | K11: of:=[.L11]/[.C$49] -> 2520 | L11: of:=[.L5]*0.042 -> 2923.2 | M11: of:=[.L11]/[.L$4]*100 -> 3.84624493759325 | N11: AHV
B12: KV | C12: +1.1% Zusatzbeitrag | D12: of:=IF([.D$5]>[.C42]; [.C42] * [.E42] / 2; [.D$5] * [.E42] / 2) + [.D5] * 0.011 -> 4470.6 | E12: of:=[.D12]/[.D$4]*100 -> 6.29784824222753 | K12: of:=[.L12]/[.C$49] -> 420 | L12: of:=[.L5]*0.007 -> 487.2 | M12: of:=[.L12]/[.L$4]*100 -> 0.641040822932209 | N12: IV
B13: Arbeitslosenv | D13: of:=IF([.D$5]>[.C43]; [.C43] * [.E43] / 2; [.D$5] * [.E43] / 2) -> 900 | E13: of:=[.D13]/[.D$4]*100 -> 1.26785295441435 | K13: of:=[.L13]/[.C$49] -> 135 | L13: of:=[.L5]*0.00225 -> 156.6 | M13: of:=[.L13]/[.L$4]*100 -> 0.206048835942496 | N13: EO
B14: Pflegev | C14: +0.25% fuer Kinderlose | D14: of:=IF([.D$5]>[.C44]; [.C44] * [.E44] / 2; [.D$5] * [.E44] / 2)+[.D5]*0.0025 -> 815.55 | E14: of:=[.D14]/[.D$4]*100 -> 1.14888608552513 | K14: of:=[.L14]/[.C$49] -> 2655 | L14: of:=SUM([.L11];[.L13]) -> 3079.8 | M14: of:=[.L14]/[.L$4]*100 -> 4.05229377353575 | N14: AHV/IV/EO
B15: Summe AN | D15: of:=SUM([.D11:.D14]) -> 11796.15 | E15: of:=[.D15]/[.D$4]*100 -> 16.6175373646831 | G15: of:=[.H15]/[.C$48] -> 4590 | H15: of:=[.H5]*0.153/2 -> 5370.3 | I15: of:=[.H15]/[.H$4]*100 -> 7.10636321411983 | J15: FICA | K15: of:=[.L15]/[.C$49] -> 660 | L15: of:=IF([.L5]<[.L41];[.M41]*[.L5]; [.L41]*[.M41] + ([.L5]-[.L41])*[.N41]) -> 765.6 | M15: of:=[.L15]/[.L$4]*100 -> 1.00734986460776 | N15: ALV
K16: of:=[.L16]/[.C$49] -> 2100 | L16: of:=VLOOKUP([.C51];[.K49:.L53];2;1) * [.L5] / 2 -> 2436 | M16: of:=[.L16]/[.L$4]*100 -> 3.20520411466105 | N16: BVG
K17: of:=[.L17]/[.C$49] -> 77.5862068965517 | L17: 90 | N17: NBU | O17: ???
K18: of:=[.L18]/[.C$49] -> 25.8620689655172 | L18: 30 | N18: KTG | O18: ???
B20: Arbeitgeber
B21: RV | D21: of:=IF([.D$5]>[.C41]; [.C41] * [.E41] / 2; [.D$5] * [.E41] / 2) -> 5610 | E21: of:=[.D21]/[.D$4]*100 -> 7.9029500825161 | N21: Arbeitgeber
B22: KV | D22: of:=IF([.D$5]>[.C42]; [.C42] * [.E42] / 2; [.D$5] * [.E42] / 2) -> 3810.6 | E22: of:=[.D22]/[.D$4]*100 -> 5.36808940899034 | K22: of:=[.L22]/[.C$49] -> 2520 | L22: of:=[.L11] -> 2923.2 | M22: of:=[.L22]/[.L$4]*100 -> 3.84624493759325 | N22: AHV
B23: Arbeitslosenv | D23: of:=IF([.D$5]>[.C43]; [.C43] * [.E43] / 2; [.D$5] * [.E43] / 2) -> 900 | E23: of:=[.D23]/[.D$4]*100 -> 1.26785295441435 | K23: of:=[.L23]/[.C$49] -> 420 | L23: of:=[.L12] -> 487.2 | M23: of:=[.L23]/[.L$4]*100 -> 0.641040822932209 | N23: IV
B24: Pflegev | D24: of:=IF([.D$5]>[.C44]; [.C44] * [.E44] / 2; [.D$5] * [.E44] / 2) -> 665.55 | E24: of:=[.D24]/[.D$4]*100 -> 0.93757725978941 | K24: of:=[.L24]/[.C$49] -> 135 | L24: of:=[.L13] -> 156.6 | M24: of:=[.L24]/[.L$4]*100 -> 0.206048835942496 | N24: EO
B25: Summe AG | D25: of:=SUM([.D21:.D24]) -> 10986.15 | E25: of:=[.D25]/[.D$4]*100 -> 15.4764697057102 | G25: of:=[.H25]/[.C$48] -> 4590 | H25: of:=[.H15] -> 5370.3 | I25: of:=[.H25]/[.H$4]*100 -> 7.10636321411983 | J25: FICA | K25: of:=[.L25]/[.C$49] -> 2655 | L25: of:=[.L14] -> 3079.8 | M25: of:=[.L25]/[.L$4]*100 -> 4.05229377353575 | N25: AHV/IV/EO
K26: of:=[.L26]/[.C$49] -> 660 | L26: of:=[.L15] -> 765.6 | M26: of:=[.L26]/[.L$4]*100 -> 1.00734986460776 | N26: ALV
K27: of:=[.L27]/[.C$49] -> 2100 | L27: of:=[.L16] -> 2436 | M27: of:=[.L27]/[.L$4]*100 -> 3.20520411466105 | N27: BVG
K28: of:=[.L28]/[.C$49] -> 77.5862068965517 | L28: of:=[.L17] -> 90 | N28: NBU
K29: of:=[.L29]/[.C$49] -> 25.8620689655172 | L29: of:=[.L18] -> 30 | N29: KTG
B32: Nach Abgaben | D32: of:=[.D5]-[.D7]-[.D11]-[.D12]-[.D13]-[.D14] -> 35517.8370464952 | E32: of:=[.D32]/[.D$4]*100 -> 50.0348829264514 | G32: of:=[.H32]/[.C$48] -> 42400.3692307692 | H32: of:=[.H5]-[.H7]-[.H8]-[.H15] -> 49608.432 | I32: of:=[.H32]/[.H$4]*100 -> 65.6454083151714 | K32: of:=[.L32]/[.C$49] -> 50492.6551724138 | L32: of:=[.L5]-[.L7]-[.L8]-[.L14]-[.L15]-[.L16]-[.L17]-[.L18] -> 58571.48 | M32: of:=[.L32]/[.L$4]*100 -> 77.06631719942
B33: Miete | D33: of:=[.C46]*12 -> 6120 | E33: of:=[.D33]/[.D$4]*100 -> 8.62140009001756 | G33: of:=[.H33]/[.C$48] -> 12820.5128205128 | H33: of:=12*[.H46] -> 15000 | I33: of:=[.H33]/[.H$4]*100 -> 19.8490676892906 | K33: of:=[.L33]/[.C$49] -> 15517.2413793103 | L33: of:=[.L46]*12 -> 18000 | M33: of:=[.L33]/[.L$4]*100 -> 23.6837742462639
B34: Zum Einkaufen | D34: of:=[.D32]-[.D33] -> 29397.8370464952 | E34: of:=[.D34]/[.D$4]*100 -> 41.4134828364338 | G34: of:=[.H34]/[.C$48] -> 29579.8564102564 | H34: of:=[.H32]-[.H33] -> 34608.432 | I34: of:=[.H34]/[.H$4]*100 -> 45.7963406258808 | K34: of:=[.L34]/[.C$49] -> 34975.4137931035 | L34: of:=[.L32]-[.L33] -> 40571.48 | M34: of:=[.L34]/[.L$4]*100 -> 53.3825429531561
B35: Davon MwSt | D35: of:=[.D34]*0.19 -> 5585.58903883408 | E35: of:=[.D35]/[.D$4]*100 -> 7.86856173892243 | G35: of:=[.H35]/[.C$48] -> 2440.33815384615 | H35: of:=0.0825*[.H34] -> 2855.19564 | I35: of:=[.H35]/[.H$4]*100 -> 3.77819810163517 | K35: of:=[.L35]/[.C$49] -> 2798.03310344828 | L35: of:=[.L34]*0.08 -> 3245.7184 | M35: of:=[.L35]/[.L$4]*100 -> 4.27060343625249
B36: Purchasing power | D36: of:=[.D34]-[.D35] -> 23812.2480076611 | E36: of:=[.D36]/[.D$4]*100 -> 33.5449210975114 | G36: of:=[.H36]/[.C$48] -> 27139.5182564103 | H36: of:=[.H34]-[.H35] -> 31753.23636 | I36: of:=[.H36]/[.H$4]*100 -> 42.0181425242456 | K36: of:=[.L36]/[.C$49] -> 32177.3806896552 | L36: of:=[.L34]-[.L35] -> 37325.7616 | M36: of:=[.L36]/[.L$4]*100 -> 49.1119395169036
B38: INPUT
C40: Beitragsbemessungsgrenzen 2017 | E40: Beitragssatz | K40: Beitragsbemessungsgrenzen 2016
B41: RV | C41: 76200 | E41: 0.187 | K41: ALV | L41: 148200 | M41: 0.011 | N41: 0.005
B42: KV | C42: 52200 | E42: 0.146
B43: Arbeitslosenv | C43: of:=[.C41] -> 76200 | E43: 0.03
B44: Pflegev | C44: of:=[.C42] -> 52200 | E44: 0.0255
B46: Monatliche Miete | C46: 510 | G46: of:=[.H46]/[.C48] -> 1068.37606837607 | H46: of:=2500/2 -> 1250 | K46: of:=[.L46]/[.C49] -> 1293.10344827586 | L46: 1500
B48: Euro to USD | C48: 1.17 | K48: Altersgenzen BVG
B49: Euro to Franc | C49: 1.16 | K49: 0 | L49: 0
K50: 25 | L50: 0.07
B51: Alter | C51: 30 | K51: 35 | L51: 0.1
K52: 45 | L52: 0.15
B53: TODO | K53: 55 | L53: 0.18
B54: US tax is most probably calculated incorrectly
B55: Swiss result incorrect
B58: Rechnung zur Einkommensteuer | F58: Rechnung federal tax | J58: Federal tax 2017 | N58: Direkte Bundesteuer 2016 | R58: Staatssteuer Zuerich 2016
J59: From | K59: rate | L59: base | N59: From | O59: rate | P59: base | R59: From | S59: rate | T59: base
B60: Werbekosten | D60: 1000 | F60: Federal Deduction + Exemption | H60: 6350 | J60: 0 | K60: 0.1 | L60: 0 | N60: 14500 | O60: 0.0077 | P60: 25.41 | R60: 0 | S60: 0 | T60: 0
B61: Einkuenfte | D61: of:=[.D5]-[.D60] -> 59000 | F61: Taxable income | H61: of:=[.H5]-[.H60] -> 63850 | J61: 9325 | K61: 0.15 | L61: of:=([.J61]-[.J60])*[.K60] + [.L60] -> 932.5 | N61: 31700 | O61: 0.0088 | P61: of:=([.N61]-[.N60])*[.O60]+[.P60] -> 157.85 | R61: 6700 | S61: 0.02 | T61: of:=([.R61]-[.R60])*[.S60]+[.T60] -> 0
F62: Applicable bracket from | H62: of:=VLOOKUP([.H$61];[.J$60:.L$66];1;1) -> 37950 | J62: 37950 | K62: 0.25 | L62: of:=([.J62]-[.J61])*[.K61] + [.L61] -> 5226.25 | N62: 41500 | O62: 0.0264 | P62: of:=([.N62]-[.N61])*[.O61]+[.P61] -> 244.09 | R62: 11400 | S62: 0.03 | T62: of:=([.R62]-[.R61])*[.S61]+[.T61] -> 94
B63: Summe der Altersvorsorgeaufwendungen | D63: of:=[.D11]+[.D21] -> 11220 | F63: Bracket base | H63: of:=VLOOKUP([.H$61];[.J$60:.L$66];3;1) -> 5226.25 | J63: 91900 | K63: 0.28 | L63: of:=([.J63]-[.J62])*[.K62] + [.L62] -> 18713.75 | N63: 55300 | O63: 0.0297 | P63: of:=([.N63]-[.N62])*[.O62]+[.P62] -> 608.41 | R63: 16100 | S63: 0.04 | T63: of:=([.R63]-[.R62])*[.S62]+[.T62] -> 235
B64: Davon 82% | C64: 82% kommt wohl aus 2017 | D64: of:=[.D63]*0.82 -> 9200.4 | F64: Bracket rate | H64: of:=VLOOKUP([.H$61];[.J$60:.L$66];2;1) -> 0.25 | J64: 191650 | K64: 0.33 | L64: of:=([.J64]-[.J63])*[.K63] + [.L63] -> 46643.75 | N64: 72600 | O64: 0.0594 | P64: of:=([.N64]-[.N63])*[.O63]+[.P63] -> 1122.22 | R64: 23700 | S64: 0.05 | T64: of:=([.R64]-[.R63])*[.S63]+[.T63] -> 539
B65: ab Arbeitgeberanteil zur RV | D65: of:=[.D21] -> 5610 | J65: 416700 | K65: 0.35 | L65: of:=([.J65]-[.J64])*[.K64] + [.L64] -> 120910.25 | N65: 78200 | O65: 0.066 | P65: of:=([.N65]-[.N64])*[.O64]+[.P64] -> 1454.86 | R65: 33000 | S65: 0.06 | T65: of:=([.R65]-[.R64])*[.S64]+[.T64] -> 1004
B66: verbleiben | D66: of:=[.D64]-[.D65] -> 3590.4 | F66: Fed tax | H66: of:=[.H63]+([.H61]-[.H62]) * [.H64] -> 11701.25 | J66: 418400 | K66: 0.396 | L66: of:=([.J66]-[.J65])*[.K65] + [.L65] -> 121505.25 | N66: 103700 | O66: 0.088 | P66: of:=([.N66]-[.N65])*[.O65]+[.P65] -> 3137.86 | R66: 43700 | S66: 0.07 | T66: of:=([.R66]-[.R65])*[.S65]+[.T65] -> 1646
N67: 134700 | O67: 0.11 | P67: of:=([.N67]-[.N66])*[.O66]+[.P66] -> 5865.86 | R67: 56100 | S67: 0.08 | T67: of:=([.R67]-[.R66])*[.S66]+[.T66] -> 2514
B68: Beitraege zur KV | D68: of:=[.D12] -> 4470.6 | N68: 176100 | O68: 0.132 | P68: of:=([.N68]-[.N67])*[.O67]+[.P67] -> 10419.86 | R68: 73000 | S68: 0.09 | T68: of:=([.R68]-[.R67])*[.S67]+[.T67] -> 3866
B69: Ab Kuerzungsbetrag | C69: ??? | D69: 0 | N69: 755300 | O69: 0.115 | P69: of:=([.N69]-[.N68])*[.O68]+[.P68] -> 86874.26 | R69: 105500 | S69: 0.1 | T69: of:=([.R69]-[.R68])*[.S68]+[.T68] -> 6791
B70: verbleiben | D70: of:=[.D68]-[.D69] -> 4470.6 | F70: Rechnung CA tax | R70: 137700 | S70: 0.11 | T70: of:=([.R70]-[.R69])*[.S69]+[.T69] -> 10011
J71: CA tax 2017 | N71: Rechnung Direkte Bundesteuer | R71: 188700 | S71: 0.12 | T71: of:=([.R71]-[.R70])*[.S70]+[.T70] -> 15621
B72: Beitraege zur PV | D72: of:=[.D14] -> 815.55 | F72: Deduction | H72: 4044 | J72: From | K72: rate | L72: base | R72: 254900 | S72: 0.13 | T72: of:=([.R72]-[.R71])*[.S71]+[.T71] -> 23565
F73: Taxable income | H73: of:=[.H5]-[.H72] -> 66156 | J73: 0 | K73: 0.01 | L73: 0 | N73: Applicable bracket from | P73: of:=VLOOKUP([.L$5];[.N$60:.P$69];1;1) -> 55300
B74: Summe der abziehbaren Versorgungsaufwendungen | D74: of:=[.D66]+[.D70]+[.D72] -> 8876.55 | F74: Applicable bracket from | H74: of:=VLOOKUP([.H$61];[.J$73:.L$82];1;1) -> 51530 | J74: 7850 | K74: 0.02 | L74: of:=([.J74]-[.J73])*[.K73] + [.L73] -> 78.5 | N74: Bracket base | P74: of:=VLOOKUP([.L$5];[.N$60:.P$69];3;1) -> 608.41 | R74: Rechnung Staatssteuer
F75: Bracket base | H75: of:=VLOOKUP([.H$61];[.J$73:.L$82];3;1) -> 2268.8 | J75: 18610 | K75: 0.04 | L75: of:=([.J75]-[.J74])*[.K74] + [.L74] -> 293.7 | N75: Bracket rate | P75: of:=VLOOKUP([.L$5];[.N$60:.P$69];2;1) -> 0.0297
B76: Einkommen | D76: of:=[.D61]-[.D74] -> 50123.45 | F76: Bracket rate | H76: of:=VLOOKUP([.H$61];[.J$73:.L$82];2;1) -> 0.093 | J76: 29372 | K76: 0.06 | L76: of:=([.J76]-[.J75])*[.K75] + [.L75] -> 724.18 | R76: Applicable bracket from | T76: of:=VLOOKUP([.L$5];[.R$60:.T$72];1;1) -> 56100
J77: 40773 | K77: 0.08 | L77: of:=([.J77]-[.J76])*[.K76] + [.L76] -> 1408.24 | N77: Direkte Bundesteuer | P77: of:=[.P74]+([.L5]-[.P73]) * [.P75] -> 1033.12 | R77: Bracket base | T77: of:=VLOOKUP([.L$5];[.R$60:.T$72];3;1) -> 2514
F78: bracket value | H78: of:=[.H75]+([.H73]-[.H74]) * [.H76] -> 3629.018 | J78: 51530 | K78: 0.093 | L78: of:=([.J78]-[.J77])*[.K77] + [.L77] -> 2268.8 | R78: Bracket rate | T78: of:=VLOOKUP([.L$5];[.R$60:.T$72];2;1) -> 0.08
F79: Personal exemption | H79: 109 | J79: 263222 | K79: 0.103 | L79: of:=([.J79]-[.J78])*[.K78] + [.L78] -> 21956.156
F80: ca tax | H80: of:=[.H78]-[.H79] -> 3520.018 | J80: 315866 | K80: 0.113 | L80: of:=([.J80]-[.J79])*[.K79] + [.L79] -> 27378.488 | R80: Staatssteuer | T80: of:=[.T77]+([.L5]-[.T76]) * [.T78] -> 3594
J81: 526443 | K81: 0.123 | L81: of:=([.J81]-[.J80])*[.K80] + [.L80] -> 51173.689
J82: 1000000 | K82: 0.133 | L82: of:=([.J82]-[.J81])*[.K81] + [.L81] -> 109421.2